{
  "protocolVersion": "1.0",
  "projectAlias": "engine",
  "project": {
    "projectId": "cardworld-engine",
    "profileId": "engine-delivery",
    "extensionId": "cardworld-engine-profile"
  },
  "observedAt": "2026-09-20T14:32:58.5007140Z",
  "summary": "Quality result acceptance did not enforce completeness against the authoritative open Finding inventory",
  "severity": "P1",
  "environment": {
    "harnessRelease": "1.0.0",
    "workspace": "F:\\CardWorld",
    "versionUnderReview": "V3.8.4"
  },
  "expected": {
    "findingCompleteness": "review output must preserve or explicitly disposition every authoritative open Finding",
    "knownInventory": [
      "R008-FSW-001",
      "R008-FSW-002",
      "R008-FSW-003",
      "R008-FSW-004",
      "R008-FSW-005",
      "R008-FSW-006",
      "V384-R06",
      "V384-R07",
      "V384-R08"
    ]
  },
  "actual": {
    "returnedFindings": [
      "V384-R06-DOC-STALE",
      "V384-R08-BUDGET-GATE"
    ],
    "omittedKnownFindings": [
      "R008-FSW-001",
      "R008-FSW-002",
      "R008-FSW-003",
      "R008-FSW-004",
      "R008-FSW-005",
      "R008-FSW-006",
      "V384-R07"
    ],
    "lifecycleEffect": "no completeness error was surfaced before the Host transport failure, allowing the review result to be treated as structurally acceptable despite missing authoritative items"
  },
  "reproduction": {
    "steps": [
      "Run h:engine quality V3.8.4 against the documented V3.8.4 quality state.",
      "Compare the review result with docs/versions/v3/v3.8.4.md and docs/versions/INDEX.md authoritative open Finding inventory.",
      "Observe that six open P1 findings R008-FSW-001 through R008-FSW-006 and deferred P2 V384-R07 are absent from the returned findings.",
      "Observe no Harness completeness guard or deterministic missing-Finding rejection before transport/reconciliation handling."
    ]
  },
  "conversation": {
    "source": "current-thread",
    "excerpts": [
      {
        "role": "user",
        "text": "我已知的问题有 6 个开放 P1（R008-FSW-001～R008-FSW-006）和 3 个延期 P2（V384-R06～V384-R08），这些问题去哪里了？"
      },
      {
        "role": "assistant",
        "text": "复核后确认：审查结果只返回两个 P2，遗漏了六个 R008-FSW P1 以及 V384-R07；这属于 Harness 质量结果完整性校验缺口。"
      }
    ]
  },
  "missingEvidence": [
    "未取得 Harness 内部完整性校验实现的独立源码审计结论。"
  ],
  "sanitization": {
    "confirmed": true,
    "removed": [
      "未包含凭据、访问令牌、私钥或无关对话内容。"
    ]
  },
  "intakeDigest": "a79db71dea402fb8c96c5209986ae92cfcaba55ee0a83cc5efd6d13bf484b267"
}
