{
  "protocolVersion": "1.0",
  "projectAlias": "engine",
  "project": {
    "projectId": "cardworld-engine",
    "profileId": "engine-delivery",
    "extensionId": "cardworld-engine-profile"
  },
  "observedAt": "2026-09-13T13:06:44.4627696Z",
  "summary": "Bound Agent Harness cannot execute the engine quality command because its active data root is uninitialized, the extension registry is empty, and project registry access hits EPERM.",
  "severity": "P2",
  "environment": {
    "boundControlRoot": "F:\\agent-harness",
    "boundDataRoot": "F:\\agent-harness\\.agent-harness-data",
    "boundWorkspaceRoot": "F:\\CardWorld",
    "currentWorkspaceRoot": "C:\\Users\\86150\\.codex\\worktrees\\0561\\CardWorld",
    "workspaceMismatch": true,
    "command": "h:engine quality V3.8.4"
  },
  "expected": "The bound Harness installation should expose a writable initialized data root, the registered engine extension and project descriptor, and permit the quality workflow to resolve and start.",
  "actual": {
    "doctor": "releaseVerified=true; initialized=false",
    "extensions": "registeredExtensions=[]",
    "projectList": "EPERM while creating F:\\agent-harness\\.agent-harness-data\\authority",
    "lifecycle": "quality command stopped at attention-required before Run creation"
  },
  "reproduction": {
    "steps": [
      "Resolve the engine binding from the installed plugin binding file.",
      "Run the bound Harness doctor against F:\\agent-harness and F:\\agent-harness\\.agent-harness-data.",
      "Observe releaseVerified=true but initialized=false.",
      "Run extension list and observe an empty extension registry.",
      "Run project list and observe EPERM while creating the authority directory.",
      "Resolve h:engine quality V3.8.4 and observe that the lifecycle preflight cannot proceed."
    ]
  },
  "conversation": {
    "source": "current-thread",
    "excerpts": [
      {
        "role": "user",
        "text": "h:engine quality V3.8.4"
      },
      {
        "role": "tool",
        "text": "Harness doctor returned ok=true, releaseVerified=true, initialized=false, and registeredExtensions=[]."
      },
      {
        "role": "tool",
        "text": "Project listing returned EPERM while creating F:\\agent-harness\\.agent-harness-data\\authority."
      },
      {
        "role": "assistant",
        "text": "The quality command was stopped before Run creation because the Harness data root and registries were not ready."
      },
      {
        "role": "user",
        "text": "Harness 的运行环境/绑定是要在agent-harness处理吗？还是我们项目内要注册agent-harness？"
      }
    ]
  },
  "missingEvidence": [
    "No Hook-provided command ID was exposed in the conversation context; this report uses a fresh recorder command ID.",
    "No active Project Descriptor or Extension artifact identity was available from the bound registry.",
    "No Authority revision or Run ID was available because the active data root is uninitialized."
  ],
  "sanitization": {
    "confirmed": true,
    "removed": [
      "Credentials, tokens, and unrelated conversation content."
    ]
  },
  "intakeDigest": "da8ca73021dbd2d0bda2e4f65c04e63bf53f9a15fbea44933b55fd7090b70ddd"
}
