{
  "protocolVersion": "1.0",
  "projectAlias": "engine",
  "project": {
    "projectId": "cardworld-engine",
    "profileId": "engine-delivery",
    "extensionId": "cardworld-engine-profile"
  },
  "observedAt": "2026-09-15T14:24:58.9924421Z",
  "summary": "conversation-visible 宿主桥接失败后未等待或收容已创建的子智能体，并继续启动后续 Dispatch；共享桥接契约可能影响所有 conversation-visible 流程。",
  "severity": "P1",
  "environment": {
    "harnessRelease": "1.0.0",
    "projectId": "cardworld-engine",
    "executionMode": "conversation-visible",
    "activeRunStatus": "running",
    "activeRunRevision": 8,
    "activeRunGeneration": 4,
    "activeLeaseCount": 0,
    "observedDispatchCount": 4
  },
  "expected": {
    "dispatchLifecycle": [
      "一个已创建的子智能体必须先被唯一观察并绑定 Lease，随后等待并消费其终态结果，才能推进同一串行 Feature。",
      "若 Spawn 后的宿主契约校验失败，必须先中断或以可验证方式收容已创建的子智能体，再允许恢复或创建后续 Transport。"
    ],
    "sharedHostContract": "对 spawn、inspect、wait、interrupt 和 result 的真实宿主契约进行版本化验证，并覆盖所有选择 conversation-visible Runtime 的生命周期动作。"
  },
  "actual": {
    "unawaitedAgent": "原生 spawn_agent 已返回成功结果，但适配器在 Lease 绑定前拒绝返回 envelope；失败路径未等待该子智能体的终态。",
    "uncontainedAgent": "失败路径没有保存可用于观察或中断的原生 Agent 身份，也没有调用 interrupt_agent；后续 ordinary resume 继续调度了新 Dispatch。",
    "authorityObservation": "同一 active Run 已推进到 generation 4，存在四个 requested/superseded Dispatch 且没有 Lease，因此 Authority 无法证明先前原生子智能体已经终止。",
    "commonImpact": "Codex visible lifecycle Coordinator 对所有 conversation-visible 动作复用同一 Host Adapter；现有测试只模拟了非真实的 task_name 返回，因此单点修补不足以证明其它流程可用。"
  },
  "reproduction": {
    "steps": [
      "运行 h:engine quality V3.8.4，使 Coordinator 创建首个原生子智能体。",
      "将当前宿主的 spawn_agent 原生返回原样交给 Coordinator；适配器以 CODEX_COLLABORATION_SPAWN_RESULT_INVALID 失败。",
      "观察失败路径未等待或中断已创建的子智能体，并且 Authority 中未产生 Lease。",
      "再次运行同一生命周期命令；ordinary resume 使 generation 增加并请求新的 Dispatch，而上一原生子智能体没有可验证的终止或收容 Receipt。",
      "检查其它 conversation-visible 动作，确认它们共享同一 Codex collaboration Host Adapter 和相同的未验证边界。"
    ]
  },
  "conversation": {
    "source": "current-thread",
    "excerpts": [
      {
        "role": "user",
        "text": "还有几个问题没有记录成功，我补充一下\n1、没有等待智能体的返回，就直接开启下一个智能体\\\n2、开启下一个智能体之前没有关闭上一次你认为失败的智能体\\\n3、既然协议会不兼容，那后续所有流程都跑不下去了，所以这个是个共性的问题，需要深入去找是不是所有流程都有问题"
      },
      {
        "role": "assistant",
        "text": "只读审查确认：当前 active Run 为 running、revision 8、generation 4，存在四个 requested/superseded Dispatch 且没有 Lease；Codex visible lifecycle Coordinator 对 conversation-visible 动作复用同一 Host Adapter。"
      }
    ]
  },
  "missingEvidence": [
    "先前已创建原生子智能体的当前状态和最终输出不可用，因为失败路径未持久化可观察身份或 Lease。",
    "宿主未提供可绑定的 collaboration 工具 manifest、协议版本或契约摘要。",
    "尚无覆盖所有 conversation-visible 动作及 spawn/list/wait/interrupt/result 的真实产品宿主 Canary。"
  ],
  "correlation": {
    "category": "host-integration",
    "failureCode": "CODEX_COLLABORATION_SPAWN_RESULT_INVALID",
    "scope": "conversation-visible lifecycle dispatch"
  },
  "sanitization": {
    "confirmed": true,
    "removed": [
      "未记录原生 agent_id、nickname、session/request ID、Dispatch UUID、Prompt 内容或完整业务仓路径。"
    ]
  },
  "incidentFingerprint": "605cad36c045c671d814e1add2d90fb81d52155c1673278ff21298937e9142ca",
  "intakeDigest": "570c48837b4edbf14b047c2c64d5c6b7e34cca43c4d6f2b3a3b710a776733759"
}
